{
  "amount": 1099,
  "tax_amount": 1099,
  "tip_amount": 1099,
  "additional_charges": {},
  "amount_refunded": 1099,
  "partial_auth": true,
  "billing_details": {},
  "captured": true,
  "created": 1718153645000,
  "currency": "USD",
  "customer": "example-customer",
  "description": "Example description value.",
  "external_reference_id": "9ABCDEF1234567",
  "external_customer_reference": "example-external_customer_reference",
  "auth_code": "ABC123",
  "ref_num": "example-ref_num",
  "failure_code": "ABC123",
  "failure_message": "Example failure_message value.",
  "warning_message": "Example warning_message value.",
  "id": "9ABCDEF1234567",
  "livemode": true,
  "metadata": "example-metadata",
  "object": "charge",
  "order": "example-order",
  "outcome": {},
  "paid": true,
  "payment_method_details": "card",
  "on_behalf_of": true,
  "debt_payment": "approved",
  "receipt_email": "merchant@example.com",
  "receipt_number": "example-receipt_number",
  "receipt_url": "https://www.clover.com/example",
  "site_url": "https://www.clover.com/example",
  "refunded": true,
  "shipping": "example-shipping",
  "source": {},
  "status": "succeeded",
  "stored_credentials": {},
  "soft_descriptor": {},
  "threeds": {},
  "gift_card": {},
  "level2": {},
  "level3": {},
  "saved_credentials_on_file": {},
  "ecomind": "ecom",
  "amount_captured": 1099
}